{
  "date": "2026-08-14",
  "generated_at_et": "2026-08-14T08:06:26-04:00",
  "research_minutes": null,
  "truncated": true,
  "pipeline_failure": true,
  "data_quality_notes": "NO RECOMMENDATIONS PUBLISHED. The synthesis phase did not produce a usable report (report.json was never written). Research notes contain 0 candidate block(s) and 38441 characters, but were not converted into a report. Tail of the log: ...ord: on 2026-07-20 HD fell >1% as **rising crude pushed the 10-year Treasury yield to 4.60%**, hurting the housing-demand outlook. The 10y is now 4.68% \u2014 higher still.\n- Watch: comparable-store sales, Pro vs DIY demand split, digital growth, FY guidance.\n- HD 341.70, at sma20 340.69, -13.4% off its 6m high.\n- sources: https://finance.yahoo.com/markets/stocks/articles/ahead-home-depot-hd-q2-131502062.html , https://www.tikr.com/blog/home-depot-reports-q2-2026-earnings-on-august-18-can-it-finally-break-out , https://www.fool.com/investing/2026/08/12/should-you-buy-home-depot-stock-before-aug-18/ Treat today as a no-signal day rather than a neutral one \u2014 the pipeline failed, it did not conclude that there was nothing to trade.",
  "market_context": {
    "summary": "Unavailable \u2014 the report pipeline did not complete.",
    "regime": "unknown"
  },
  "recommendations": [],
  "watchlist": []
}
